{
    "$schema": "http://json-schema.org/draft-04/schema#",
    "type": "object",
    "properties": {
        "title": {
            "type": "string"
        },
        "description": {
            "type": "string"
        },
        "version": {
            "type": "string"
        },
        "baseUrl": {
            "type": "string",
            "pattern": "^(http(?:s)?\\:\\/\\/[a-zA-Z0-9]+(?:(?:\\.|\\-)[a-zA-Z0-9]+)+(?:\\:\\d+)?(?:\\/[\\w\\-]+)*(?:\\/?|\\/\\w+\\.[a-zA-Z]{2,4}(?:\\?[\\w]+\\=[\\w\\-]+)?)?(?:\\&[\\w]+\\=[\\w\\-]+)*)$"
        },
        "dataFormats": {
            "type": "array",
            "items": {
                "type": "string",
                "pattern": "^([\\w.+-]+/[\\w.+-]+)$"
            },
            "uniqueItems": true,
            "minItems": 1
        },
        "authenticationMechanism": {
            "type": "string"
        },
        "encoding": {
            "type": "string"
        },
        "timeZone": {
            "type": "string"
        },
        "dateFormat": {
            "type": "string"
        },
        "roles": {
            "type": "array",
            "items": { "$ref": "#/definitions/role" },
            "uniqueItems": true,
            "minItems": 0
        },
        "database": {
            "type": "object",
            "properties": {
                "dbms": {
                    "type": "string"
                },
                "name": {
                    "type": "string"
                },
                "host": {
                    "type": "string"
                },
                "port": {
                    "type": "integer"
                },
                "prefix": {
                    "type": "string"
                },
                "admin": {
                    "type": "object",
                    "properties": {
                        "name": {
                            "type": "string"
                        },
                        "password": {
                            "type": "string"
                        }
                    },
                    "required": ["name", "password"]
                }
            }
        },
        "types": {
            "type": "array",
            "items": { "$ref": "#/definitions/field" },
            "uniqueItems": true,
            "minItems": 0
        },
        "resources": {
            "type": "array",
            "items": { "$ref": "#/definitions/resource" },
            "uniqueItems": true,
            "minItems": 1
        }
    },
    "required": ["baseUrl", "dataFormats", "database", "resources"],
    "additionalProperties": true,

    "definitions": {

        "role": {
            "type": "object",
            "properties": {
                "name": {
                    "type": "string"
                },
                "isAdmin": {
                    "type": "boolean"
                },
                "isGuest": {
                    "type": "boolean"
                },
                "isA": {
                    "type": "string"
                },
                "rateLimit": {
                    "type": "object",
                    "properties": {
                        "numOfRequests": {
                            "type": "integer",
                            "minimum": 0
                        },
                        "refreshTime": {
                            "type": "integer",
                            "minimum": 0
                        }
                    },
                    "required": ["numOfRequests", "refreshTime"]
                }
            },
            "required": ["name"]
        },

        "check": {
            "type": "array",
            "items": {
                "type": "string"
            },
            "uniqueItems": true,
            "minItems": 0
        },

        "index": {
            "type": "array",
            "items": {
                "type": "string"
            },
            "uniqueItems": true,
            "minItems": 0
        },

        "resource": {
            "type": "object",
            "properties": {
                "name": {
                    "type": "string"
                },
                "displayName": {
                    "type": "string"
                },
                "plural": {
                    "type": "string"
                },
                "description": {
                    "type": "string"
                },
                "base": {
                    "type": "string"
                },
                "abstract": {
                    "type": "boolean"
                },
                "inheritanceStrategy": {
                    "type": "string"
                },
                "paginable": {
                    "type": "boolean"
                },
                "idInjection": {
                    "type": "boolean"
                },
                "fields": {
                    "type": "array",
                    "items": { "$ref": "#/definitions/field" },
                    "uniqueItems": true,
                    "minItems": 1
                },
                "acceptExtraFields": {
                    "type": "boolean"
                },
                "relations": {
                    "type": "array",
                    "items": { "$ref": "#/definitions/relation" },
                    "uniqueItems": true,
                    "minItems": 0
                },
                "check": { "$ref": "#/definitions/check" },
                "index": { "$ref": "#/definitions/index" },
                "acl": { "$ref": "#/definitions/acl" }
            },
            "required": ["name", "fields"]
        },

        "field": {
            "type": "object",
            "properties": {
                "name": {
                    "type": "string"
                },
                "description": {
                    "type": "string"
                },
                "type": {
                    "type": "string"
                },
                "required": {
                    "type": "boolean"
                },
                "min": {
                    "type": "integer"
                },
                "max": {
                    "type": "integer"
                },
                "enum": {
                    "type": "array",
                    "uniqueItems": true,
                    "minItems": 1
                },
                "precision": {
                    "type": "array",
                    "items": {
                        "type": "integer"
                    },
                    "uniqueItems": false,
                    "minItems": 2,
                    "maxItems": 2
                },
                "default": {},
                "onUpdate": {
                    "type": "string"
                },
                "unique": {
                    "type": "boolean"
                },
                "pattern": {
                    "type": "string"
                },
                "filterable": {
                    "type": "boolean"
                },
                "sortable": {
                    "type": "boolean"
                },
                "readOnly": {
                    "type": "boolean"
                },
                "writeOnly": {
                    "type": "boolean"
                },
                "encrypted": {
                    "type": "boolean"
                }
            },
            "required": ["name", "type"]
        },

        "relation": {
            "type": "object",
            "properties": {
                "with": {
                    "type": "string"
                },
                "type": {
                    "type": "string",
                    "enum": ["hasOne", "hasMany"]
                },
                "min": {
                    "type": "integer"
                },
                "max": {
                    "type": "integer"
                },
                "embed": {
                    "type": "boolean"
                },
                "onDelete": {
                    "type": "string"
                },
                "onUpdate": {
                    "type": "string"
                },
                "fields": {
                    "type": "array",
                    "items": { "$ref": "#/definitions/field" },
                    "uniqueItems": true,
                    "minItems": 0
                },
                "check": { "$ref": "#/definitions/check" },
                "index": { "$ref": "#/definitions/index" }
            },
            "required": ["with", "type"]
        },

        "aclSimple": {
            "type": "array",
            "items": {
                "type": "string",
                "pattern": "^([a-zA-Z0-9_]{1,}(\\+[a-zA-Z0-9_]{1,}){0,1})$"
            },
            "uniqueItems": true,
            "minItems": 0
        },

        "acl": {
            "oneOf": [
                { "$ref": "#/definitions/aclSimple" },
                {
                    "type": "object",
                    "properties": {
                        "read": { "$ref": "#/definitions/aclSimple" },
                        "create": { "$ref": "#/definitions/aclSimple" },
                        "update": { "$ref": "#/definitions/aclSimple" },
                        "delete": { "$ref": "#/definitions/aclSimple" }
                    }
                }
            ]
        }

    }
}